{
  "node_id": "EP-000",
  "status": "CLOSED_BLOCKED",
  "blocked_at_utc": "2026-09-09T07:00:00Z",
  "candidate_epoch": "0",
  "commit_sha": "d9c5be76aaaeb329f474f6a6843b548748a24d77",
  "primary_blocker_class": "BLOCKED_INSUFFICIENT_EVIDENCE",
  "secondary_blocker_classes": ["BLOCKED_MISSING_REQUIREMENT"],
  "blocked_requirement_ids": ["REQ-037", "REQ-038", "REQ-058"],
  "blocked_test_ids": ["V-000", "V-021"],
  "blocked_artifacts": [".agent/state/LEDGER.jsonl", ".agent/state/LEDGER.md", "frontier audit card"],
  "what_was_attempted": [
    "Read AGENTS.md, project brief, architecture, security, testing, commands, graph, DONE_LAW, LOOPS, and EP-000.",
    "Ran sh scripts/preflight.sh (exit 0).",
    "Ran python3 scripts/validate-generated-pack.py . (exit 0).",
    "Ran python3 scripts/anti-gaming-scan.py . (exit 0; blueprint classification reports zero production implementation matches).",
    "Ran python3 scripts/validate-hash-ledger.py (exit 1).",
    "Ran sh scripts/dod-gate.sh (exit 0; defers executed-status validation to V-021).",
    "Ran sh scripts/graph-next.sh (exit 0; EP-000 remains READY).",
    "Inspected the ledger writer and validator; the existing JSONL entry is legacy-shaped and fails the validator at line 1."
  ],
  "evidence_paths": [
    ".agent/evidence/EP-000/preflight.current.txt",
    ".agent/evidence/EP-000/pack_validation.current.txt",
    ".agent/evidence/EP-000/anti_gaming.current.txt",
    ".agent/evidence/EP-000/hash_ledger.current.txt",
    ".agent/evidence/EP-000/dod_gate.current.txt",
    ".agent/evidence/EP-000/graph_next.current.txt",
    ".agent/state/LEDGER.jsonl"
  ],
  "evidence_hashes": [
    "e26640c828ae8f8d6b009acc070bb6549400322788b5d3582f2912e45f20d71e",
    "d2863e7d21a220adf508c68c237014a2fea5e63e9945089d275ccf69fc448f1a",
    "4c49f1dad9f44d0c01e999c7b2816e8fcab97de3df342b86e4105208ced110ee",
    "2b839292d309ba67b60e8b2c88041df9f084ecf2fa156ab5a5b31dc6ed4618c0",
    "8aea519a0f15f3933f5c631fcbc1600ac5f953efeeda8e336a876d6c03b70eda",
    "63e9c741b112ebc8112c1ad56fc1ee80ad66af74848d558569d28911a1f19706",
    "ee25584c3e6416c232fe4fa66db129599eb905de3355d14e8666755726c4f457"
  ],
  "exact_failure_observed": "python3 scripts/validate-hash-ledger.py exits 1 with: line 1: missing event_id; .agent/state/LEDGER.jsonl line 1 contains only event, node_id, timestamp, and evidence_dir.",
  "why_it_cannot_be_safely_completed": "EP-000 requires evidence hashes and a valid ledger event, while the repository ledger cannot pass its own validator. Marking the node done would create a false completion claim and would violate the strict dependency graph.",
  "why_mocking_or_simulation_is_forbidden": "The ledger is the control-plane integrity record. Replacing the failing validation with a fabricated PASS or editing evidence to imply a valid chain would destroy independent verification.",
  "downstream_nodes_blocked": ["EP-001"],
  "downstream_nodes_not_blocked": [],
  "capabilities_not_delivered": ["valid hash-chained ledger evidence", "independent frontier audit PASS", "NODE_DONE transition for EP-000"],
  "release_verdict_impact": "NO_GO_UNVERIFIED; no production/store deployment occurred.",
  "unblock_condition": "Repository owner must reconcile the legacy LEDGER.jsonl format with the validator/writer contract through a reviewed, reversible control-plane change, then rerun hash-ledger validation and obtain the required independent codex frontier audit card PASS.",
  "unblock_owner": "repo",
  "followup_node_or_ticket": "EP-000 remediation: ledger contract reconciliation and frontier audit",
  "scheduler_instruction": "Do not dispatch EP-001 or later nodes; rerun graph-next after the blocker is remediated and independently audited.",
  "prohibited_workarounds": [
    "Do not mark EP-000 NODE_DONE while hash-ledger validation fails.",
    "Do not delete or rewrite the existing ledger entry without a reviewed migration and rollback evidence.",
    "Do not fabricate a codex audit result or treat local executor output as frontier audit.",
    "Do not deploy the product or store artifact."
  ]
}
